metric,random_like_rule,first_random_like_round_in_available_data,evidence,limitation
aggregate mean flip ratio,abs(mean - 0.5) <= 0.001,13,9-12 rounds remain below threshold; 13-15 rounds are within 0.001 in 9-15 data; 16/32 are also near 0.5.,"Threshold is an interpretation aid, not a formal statistical test."
output-bit SAC style Holm rejects,round has zero output bits rejecting baseline 0.5 after Holm correction,14,"Holm reject count decreases 35 at 12 rounds, 1 at 13 rounds, then 0 at 14/15/16/32 rounds.",Uses output-bit aggregate over random input bit flips; input-localized effects can be hidden.
input-output localized heatmap,input bits 224..254 mean abs delta falls near all-cell mean abs delta,14,"224..254 mean abs delta: 12=0.098593, 13=0.033291, 14=0.022493, 16=0.021961.",Exploratory heatmap with 320 samples per cell and no per-cell multiple testing.
"BIC all output pairs, random input bit mode",zero output bit pairs reject independence after Holm correction,13,12 rounds has 22 rejected pairs; 13/14/16 rounds have 0 rejected pairs.,Random input bit mode can average out fixed-input local dependence.
"BIC selected rejected bits, fixed input bits",max abs pair correlation becomes small in selected-bit small run,14,Max abs correlation falls from 12=0.729431 and 13=0.566370 to 14=0.067618.,Small selected-bit run without confidence intervals or multiple testing.
logistic regression distinguisher,abs(test accuracy - 0.5) <= 0.02,4,2 rounds is strongly distinguishable; 4/8/16 rounds are near baseline in existing logistic run.,9-15 and 32 rounds are not measured for this distinguisher yet; see issue #53.
